{
  "part_id": "stmicroelectronics/nucleo-f446re",
  "coverage": "partial_gpio_extract",
  "validation_status": "needs_review",
  "source_id": "pinout",
  "legacy": {
    "template_id": "pin-template-nucleo-f446re-arduino",
    "board_revision": "MB1136 / UM1724 Rev 17",
    "verification": "source_verified",
    "source_id": "st-um1724-nucleo-64",
    "source_section": "Table 19 ARDUINO connectors on NUCLEO-F446RE",
    "gpio_matrix_interfaces": [],
    "pins": [
      {
        "pin": "PB9",
        "header": "CN5.D14",
        "risk": 0,
        "tags": [
          "gpio",
          "i2c_sda"
        ]
      },
      {
        "pin": "PB8",
        "header": "CN5.D15",
        "risk": 0,
        "tags": [
          "gpio",
          "i2c_scl"
        ]
      },
      {
        "pin": "PA5",
        "header": "CN5.D13",
        "risk": 0,
        "tags": [
          "gpio",
          "spi_sclk",
          "onboard_led"
        ]
      },
      {
        "pin": "PA6",
        "header": "CN5.D12",
        "risk": 0,
        "tags": [
          "gpio",
          "spi_miso"
        ]
      },
      {
        "pin": "PA7",
        "header": "CN5.D11",
        "risk": 0,
        "tags": [
          "gpio",
          "spi_mosi",
          "pwm"
        ],
        "alternate_functions": {
          "PWM": "TIM14_CH1"
        }
      },
      {
        "pin": "PB6",
        "header": "CN5.D10",
        "risk": 0,
        "tags": [
          "gpio",
          "spi_cs",
          "pwm"
        ],
        "alternate_functions": {
          "PWM": "TIM4_CH1"
        }
      },
      {
        "pin": "PC7",
        "header": "CN5.D9",
        "risk": 0,
        "tags": [
          "gpio",
          "pwm"
        ],
        "alternate_functions": {
          "PWM": "TIM8_CH2"
        }
      },
      {
        "pin": "PA9",
        "header": "CN5.D8",
        "risk": 1,
        "tags": [
          "gpio"
        ]
      },
      {
        "pin": "PA8",
        "header": "CN9.D7",
        "risk": 1,
        "tags": [
          "gpio"
        ]
      },
      {
        "pin": "PB10",
        "header": "CN9.D6",
        "risk": 0,
        "tags": [
          "gpio",
          "pwm"
        ],
        "pwm_priority": 1,
        "alternate_functions": {
          "PWM": "TIM2_CH3"
        }
      },
      {
        "pin": "PB4",
        "header": "CN9.D5",
        "risk": 1,
        "tags": [
          "gpio",
          "pwm"
        ],
        "alternate_functions": {
          "PWM": "TIM3_CH1"
        }
      },
      {
        "pin": "PB5",
        "header": "CN9.D4",
        "risk": 1,
        "tags": [
          "gpio"
        ]
      },
      {
        "pin": "PB3",
        "header": "CN9.D3",
        "risk": 2,
        "tags": [
          "gpio",
          "pwm"
        ],
        "pwm_priority": 0,
        "alternate_functions": {
          "PWM": "TIM2_CH2"
        }
      },
      {
        "pin": "PA10",
        "header": "CN9.D2",
        "risk": 1,
        "tags": [
          "gpio"
        ]
      },
      {
        "pin": "PA2",
        "header": "CN9.D1",
        "risk": 7,
        "tags": [
          "gpio",
          "uart_tx",
          "stlink_vcp"
        ]
      },
      {
        "pin": "PA3",
        "header": "CN9.D0",
        "risk": 7,
        "tags": [
          "gpio",
          "uart_rx",
          "stlink_vcp"
        ]
      },
      {
        "pin": "PA13",
        "header": "CN7",
        "risk": 9,
        "tags": [
          "gpio",
          "swdio"
        ]
      },
      {
        "pin": "PA14",
        "header": "CN7",
        "risk": 9,
        "tags": [
          "gpio",
          "swclk"
        ]
      }
    ]
  }
}
