{
  "part_id": "stmicroelectronics/nucleo-u575zi-q",
  "coverage": "partial_gpio_extract",
  "validation_status": "needs_review",
  "source_id": "pinout",
  "legacy": {
    "template_id": "pin-template-nucleo-u575zi-q-zio",
    "board_revision": "MB1549C / UM2861 Rev 10",
    "verification": "source_verified",
    "source_id": "st-um2861-nucleo-u5-144",
    "source_section": "Tables 15-20 Zio, ST morpho and solder bridge assignments",
    "gpio_matrix_interfaces": [],
    "pins": [
      {
        "pin": "PB9",
        "header": "CN7.D14",
        "risk": 0,
        "tags": [
          "gpio",
          "i2c_sda"
        ]
      },
      {
        "pin": "PB8",
        "header": "CN7.D15",
        "risk": 0,
        "tags": [
          "gpio",
          "i2c_scl"
        ]
      },
      {
        "pin": "PA5",
        "header": "CN7.D13",
        "risk": 2,
        "tags": [
          "gpio",
          "spi_sclk",
          "optional_led"
        ]
      },
      {
        "pin": "PA6",
        "header": "CN7.D12",
        "risk": 0,
        "tags": [
          "gpio",
          "spi_miso"
        ]
      },
      {
        "pin": "PA7",
        "header": "CN7.D11",
        "risk": 0,
        "tags": [
          "gpio",
          "spi_mosi"
        ]
      },
      {
        "pin": "PD14",
        "header": "CN7.D10",
        "risk": 0,
        "tags": [
          "gpio",
          "spi_cs",
          "pwm"
        ],
        "pwm_priority": 0,
        "alternate_functions": {
          "PWM": "TIM4_CH3"
        }
      },
      {
        "pin": "PD15",
        "header": "CN7.D9",
        "risk": 0,
        "tags": [
          "gpio",
          "pwm"
        ],
        "pwm_priority": 1,
        "alternate_functions": {
          "PWM": "TIM4_CH4"
        }
      },
      {
        "pin": "PF12",
        "header": "CN7.D8",
        "risk": 0,
        "tags": [
          "gpio"
        ]
      },
      {
        "pin": "PF13",
        "header": "CN10.D7",
        "risk": 0,
        "tags": [
          "gpio"
        ]
      },
      {
        "pin": "PE9",
        "header": "CN10.D6",
        "risk": 0,
        "tags": [
          "gpio",
          "pwm"
        ],
        "alternate_functions": {
          "PWM": "TIM1_CH1"
        }
      },
      {
        "pin": "PE11",
        "header": "CN10.D5",
        "risk": 0,
        "tags": [
          "gpio",
          "pwm"
        ],
        "alternate_functions": {
          "PWM": "TIM1_CH2"
        }
      },
      {
        "pin": "PF14",
        "header": "CN10.D4",
        "risk": 0,
        "tags": [
          "gpio"
        ]
      },
      {
        "pin": "PE13",
        "header": "CN10.D3",
        "risk": 0,
        "tags": [
          "gpio",
          "pwm"
        ],
        "alternate_functions": {
          "PWM": "TIM1_CH3"
        }
      },
      {
        "pin": "PF15",
        "header": "CN10.D2",
        "risk": 0,
        "tags": [
          "gpio"
        ]
      },
      {
        "pin": "PG7",
        "header": "CN10.D1",
        "risk": 3,
        "tags": [
          "gpio",
          "uart_tx",
          "vddio2"
        ]
      },
      {
        "pin": "PG8",
        "header": "CN10.D0",
        "risk": 3,
        "tags": [
          "gpio",
          "uart_rx",
          "vddio2"
        ]
      },
      {
        "pin": "PD0",
        "header": "CN9.D67",
        "risk": 1,
        "tags": [
          "gpio",
          "can_rx"
        ]
      },
      {
        "pin": "PD1",
        "header": "CN9.D66",
        "risk": 1,
        "tags": [
          "gpio",
          "can_tx"
        ]
      },
      {
        "pin": "PC13",
        "header": "CN11.23",
        "risk": 8,
        "tags": [
          "gpio",
          "user_button"
        ]
      },
      {
        "pin": "PA13",
        "header": "CN11.13",
        "risk": 9,
        "tags": [
          "gpio",
          "swdio"
        ]
      },
      {
        "pin": "PA14",
        "header": "CN11.15",
        "risk": 9,
        "tags": [
          "gpio",
          "swclk"
        ]
      },
      {
        "pin": "PH3",
        "header": "CN11.7",
        "risk": 9,
        "tags": [
          "gpio",
          "boot0"
        ]
      },
      {
        "pin": "PA11",
        "header": "CN12.14",
        "risk": 8,
        "tags": [
          "gpio",
          "usb_d_minus"
        ]
      },
      {
        "pin": "PA12",
        "header": "CN12.12",
        "risk": 8,
        "tags": [
          "gpio",
          "usb_d_plus"
        ]
      },
      {
        "pin": "PA15",
        "header": "CN11.17",
        "risk": 9,
        "tags": [
          "gpio",
          "ucpd_cc1",
          "jtag"
        ]
      },
      {
        "pin": "PB15",
        "header": "CN12.26",
        "risk": 9,
        "tags": [
          "gpio",
          "ucpd_cc2"
        ]
      },
      {
        "pin": "PB7",
        "header": "CN11.21",
        "risk": 8,
        "tags": [
          "gpio",
          "onboard_blue_led"
        ]
      },
      {
        "pin": "PG2",
        "header": "CN11.42",
        "risk": 8,
        "tags": [
          "gpio",
          "onboard_red_led",
          "vddio2"
        ]
      }
    ]
  }
}
